{
  "tc_id": "TC-034",
  "tc_name": "Sufficient Follow-up Assessment",
  "metadata": {
    "n_total": 200,
    "n_experimental": 100,
    "n_control": 100,
    "population": "SAFETY",
    "followup_threshold_days": 90,
    "date_unit": "days",
    "r_version": "R version 4.6.1 (2026-06-24)"
  },
  "adequate_followup": {
    "experimental": {
      "n": 60,
      "pct": 60
    },
    "control": {
      "n": 55,
      "pct": 55
    }
  },
  "status_distribution": {
    "experimental": {
      "ongoing": 20,
      "completed": 59,
      "discontinued": 9,
      "died": 12
    },
    "control": {
      "ongoing": 19,
      "completed": 51,
      "discontinued": 16,
      "died": 14
    }
  },
  "reverse_km_followup": {
    "experimental": {
      "median": 427,
      "ci_lower": 412,
      "ci_upper": 459
    },
    "control": {
      "median": 259,
      "ci_lower": 254,
      "ci_upper": 282
    }
  },
  "fu_post_dose": {
    "experimental": {
      "n": 100,
      "mean": 109.34,
      "sd": 46.7128,
      "median": 113.5,
      "min": 2,
      "max": 228,
      "q1": 72.75,
      "q3": 138
    },
    "control": {
      "n": 100,
      "mean": 95.45,
      "sd": 37.2991,
      "median": 97.5,
      "min": 7,
      "max": 176,
      "q1": 66.75,
      "q3": 120
    }
  },
  "fu_from_randomization": {
    "experimental": {
      "n": 100,
      "mean": 410.55,
      "sd": 92.1605,
      "median": 417.5,
      "min": 175,
      "max": 597,
      "q1": 346.75,
      "q3": 475
    },
    "control": {
      "n": 100,
      "mean": 256.1,
      "sd": 65.6677,
      "median": 254,
      "min": 96,
      "max": 411,
      "q1": 210.25,
      "q3": 299
    }
  },
  "per_subject": [
    {
      "USUBJID": "SUB0001",
      "TRT01A": "Experimental",
      "RANDDT": "2023-06-30",
      "LASTDOSEDT": "2024-03-01",
      "LASTFUDT": "2024-04-27",
      "TREATDUR_W": 35,
      "FU_POST_DOSE": 57,
      "FU_FROM_RAND": 302,
      "ADEQUATE_FU": 0,
      "STATUS": 1,
      "STATUS_LABEL": "ONGOING"
    },
    {
      "USUBJID": "SUB0002",
      "TRT01A": "Experimental",
      "RANDDT": "2023-08-27",
      "LASTDOSEDT": "2024-08-04",
      "LASTFUDT": "2024-10-21",
      "TREATDUR_W": 49,
      "FU_POST_DOSE": 78,
      "FU_FROM_RAND": 421,
      "ADEQUATE_FU": 0,
      "STATUS": 2,
      "STATUS_LABEL": "COMPLETED"
    },
    {
      "USUBJID": "SUB0003",
      "TRT01A": "Control",
      "RANDDT": "2023-10-11",
      "LASTDOSEDT": "2024-03-20",
      "LASTFUDT": "2024-07-04",
      "TREATDUR_W": 23,
      "FU_POST_DOSE": 106,
      "FU_FROM_RAND": 267,
      "ADEQUATE_FU": 1,
      "STATUS": 2,
      "STATUS_LABEL": "COMPLETED"
    },
    {
      "USUBJID": "SUB0004",
      "TRT01A": "Experimental",
      "RANDDT": "2023-09-09",
      "LASTDOSEDT": "2023-11-11",
      "LASTFUDT": "2024-03-02",
      "TREATDUR_W": 9,
      "FU_POST_DOSE": 112,
      "FU_FROM_RAND": 175,
      "ADEQUATE_FU": 1,
      "STATUS": 2,
      "STATUS_LABEL": "COMPLETED"
    },
    {
      "USUBJID": "SUB0005",
      "TRT01A": "Control",
      "RANDDT": "2023-04-03",
      "LASTDOSEDT": "2023-08-07",
      "LASTFUDT": "2023-10-12",
      "TREATDUR_W": 18,
      "FU_POST_DOSE": 66,
      "FU_FROM_RAND": 192,
      "ADEQUATE_FU": 0,
      "STATUS": 2,
      "STATUS_LABEL": "COMPLETED"
    },
    {
      "USUBJID": "SUB0006",
      "TRT01A": "Control",
      "RANDDT": "2023-11-09",
      "LASTDOSEDT": "2024-04-11",
      "LASTFUDT": "2024-07-20",
      "TREATDUR_W": 22,
      "FU_POST_DOSE": 100,
      "FU_FROM_RAND": 254,
      "ADEQUATE_FU": 1,
      "STATUS": 2,
      "STATUS_LABEL": "COMPLETED"
    },
    {
      "USUBJID": "SUB0007",
      "TRT01A": "Control",
      "RANDDT": "2023-03-25",
      "LASTDOSEDT": "2023-07-15",
      "LASTFUDT": "2023-10-19",
      "TREATDUR_W": 16,
      "FU_POST_DOSE": 96,
      "FU_FROM_RAND": 208,
      "ADEQUATE_FU": 1,
      "STATUS": 1,
      "STATUS_LABEL": "ONGOING"
    },
    {
      "USUBJID": "SUB0008",
      "TRT01A": "Control",
      "RANDDT": "2023-08-13",
      "LASTDOSEDT": "2023-10-29",
      "LASTFUDT": "2023-12-18",
      "TREATDUR_W": 11,
      "FU_POST_DOSE": 50,
      "FU_FROM_RAND": 127,
      "ADEQUATE_FU": 0,
      "STATUS": 2,
      "STATUS_LABEL": "COMPLETED"
    },
    {
      "USUBJID": "SUB0009",
      "TRT01A": "Experimental",
      "RANDDT": "2023-03-02",
      "LASTDOSEDT": "2024-01-18",
      "LASTFUDT": "2024-04-12",
      "TREATDUR_W": 46,
      "FU_POST_DOSE": 85,
      "FU_FROM_RAND": 407,
      "ADEQUATE_FU": 0,
      "STATUS": 2,
      "STATUS_LABEL": "COMPLETED"
    },
    {
      "USUBJID": "SUB0010",
      "TRT01A": "Experimental",
      "RANDDT": "2023-04-12",
      "LASTDOSEDT": "2024-01-31",
      "LASTFUDT": "2024-05-06",
      "TREATDUR_W": 42,
      "FU_POST_DOSE": 96,
      "FU_FROM_RAND": 390,
      "ADEQUATE_FU": 1,
      "STATUS": 2,
      "STATUS_LABEL": "COMPLETED"
    },
    {
      "USUBJID": "SUB0011",
      "TRT01A": "Experimental",
      "RANDDT": "2023-06-20",
      "LASTDOSEDT": "2024-10-01",
      "LASTFUDT": "2025-02-06",
      "TREATDUR_W": 67,
      "FU_POST_DOSE": 128,
      "FU_FROM_RAND": 597,
      "ADEQUATE_FU": 1,
      "STATUS": 2,
      "STATUS_LABEL": "COMPLETED"
    },
    {
      "USUBJID": "SUB0012",
      "TRT01A": "Experimental",
      "RANDDT": "2023-05-30",
      "LASTDOSEDT": "2024-04-30",
      "LASTFUDT": "2024-08-25",
      "TREATDUR_W": 48,
      "FU_POST_DOSE": 117,
      "FU_FROM_RAND": 453,
      "ADEQUATE_FU": 1,
      "STATUS": 3,
      "STATUS_LABEL": "DISCONTINUED"
    },
    {
      "USUBJID": "SUB0013",
      "TRT01A": "Experimental",
      "RANDDT": "2023-07-01",
      "LASTDOSEDT": "2024-06-29",
      "LASTFUDT": "2024-12-15",
      "TREATDUR_W": 52,
      "FU_POST_DOSE": 169,
      "FU_FROM_RAND": 533,
      "ADEQUATE_FU": 1,
      "STATUS": 2,
      "STATUS_LABEL": "COMPLETED"
    },
    {
      "USUBJID": "SUB0014",
      "TRT01A": "Control",
      "RANDDT": "2023-11-06",
      "LASTDOSEDT": "2024-06-17",
      "LASTFUDT": "2024-10-17",
      "TREATDUR_W": 32,
      "FU_POST_DOSE": 122,
      "FU_FROM_RAND": 346,
      "ADEQUATE_FU": 1,
      "STATUS": 2,
      "STATUS_LABEL": "COMPLETED"
    },
    {
      "USUBJID": "SUB0015",
      "TRT01A": "Control",
      "RANDDT": "2023-02-24",
      "LASTDOSEDT": "2023-06-16",
      "LASTFUDT": "2023-07-14",
      "TREATDUR_W": 16,
      "FU_POST_DOSE": 28,
      "FU_FROM_RAND": 140,
      "ADEQUATE_FU": 0,
      "STATUS": 3,
      "STATUS_LABEL": "DISCONTINUED"
    },
    {
      "USUBJID": "SUB0016",
      "TRT01A": "Experimental",
      "RANDDT": "2023-02-23",
      "LASTDOSEDT": "2023-11-16",
      "LASTFUDT": "2023-11-18",
      "TREATDUR_W": 38,
      "FU_POST_DOSE": 2,
      "FU_FROM_RAND": 268,
      "ADEQUATE_FU": 0,
      "STATUS": 2,
      "STATUS_LABEL": "COMPLETED"
    },
    {
      "USUBJID": "SUB0017",
      "TRT01A": "Control",
      "RANDDT": "2023-11-10",
      "LASTDOSEDT": "2023-12-29",
      "LASTFUDT": "2024-02-14",
      "TREATDUR_W": 7,
      "FU_POST_DOSE": 47,
      "FU_FROM_RAND": 96,
      "ADEQUATE_FU": 0,
      "STATUS": 3,
      "STATUS_LABEL": "DISCONTINUED"
    },
    {
      "USUBJID": "SUB0018",
      "TRT01A": "Control",
      "RANDDT": "2023-06-22",
      "LASTDOSEDT": "2023-09-21",
      "LASTFUDT": "2023-12-17",
      "TREATDUR_W": 13,
      "FU_POST_DOSE": 87,
      "FU_FROM_RAND": 178,
      "ADEQUATE_FU": 0,
      "STATUS": 2,
      "STATUS_LABEL": "COMPLETED"
    },
    {
      "USUBJID": "SUB0019",
      "TRT01A": "Control",
      "RANDDT": "2023-02-12",
      "LASTDOSEDT": "2023-08-06",
      "LASTFUDT": "2024-01-17",
      "TREATDUR_W": 25,
      "FU_POST_DOSE": 164,
      "FU_FROM_RAND": 339,
      "ADEQUATE_FU": 1,
      "STATUS": 3,
      "STATUS_LABEL": "DISCONTINUED"
    },
    {
      "USUBJID": "SUB0020",
      "TRT01A": "Control",
      "RANDDT": "2023-07-26",
      "LASTDOSEDT": "2023-10-04",
      "LASTFUDT": "2024-01-24",
      "TREATDUR_W": 10,
      "FU_POST_DOSE": 112,
      "FU_FROM_RAND": 182,
      "ADEQUATE_FU": 1,
      "STATUS": 2,
      "STATUS_LABEL": "COMPLETED"
    },
    {
      "USUBJID": "SUB0021",
      "TRT01A": "Experimental",
      "RANDDT": "2023-03-26",
      "LASTDOSEDT": "2023-11-05",
      "LASTFUDT": "2024-03-22",
      "TREATDUR_W": 32,
      "FU_POST_DOSE": 138,
      "FU_FROM_RAND": 362,
      "ADEQUATE_FU": 1,
      "STATUS": 2,
      "STATUS_LABEL": "COMPLETED"
    },
    {
      "USUBJID": "SUB0022",
      "TRT01A": "Control",
      "RANDDT": "2023-06-02",
      "LASTDOSEDT": "2023-12-29",
      "LASTFUDT": "2024-04-22",
      "TREATDUR_W": 30,
      "FU_POST_DOSE": 115,
      "FU_FROM_RAND": 325,
      "ADEQUATE_FU": 1,
      "STATUS": 1,
      "STATUS_LABEL": "ONGOING"
    },
    {
      "USUBJID": "SUB0023",
      "TRT01A": "Experimental",
      "RANDDT": "2023-12-24",
      "LASTDOSEDT": "2024-10-20",
      "LASTFUDT": "2025-02-02",
      "TREATDUR_W": 43,
      "FU_POST_DOSE": 105,
      "FU_FROM_RAND": 406,
      "ADEQUATE_FU": 1,
      "STATUS": 3,
      "STATUS_LABEL": "DISCONTINUED"
    },
    {
      "USUBJID": "SUB0024",
      "TRT01A": "Control",
      "RANDDT": "2023-08-28",
      "LASTDOSEDT": "2024-01-01",
      "LASTFUDT": "2024-04-15",
      "TREATDUR_W": 18,
      "FU_POST_DOSE": 105,
      "FU_FROM_RAND": 231,
      "ADEQUATE_FU": 1,
      "STATUS": 1,
      "STATUS_LABEL": "ONGOING"
    },
    {
      "USUBJID": "SUB0025",
      "TRT01A": "Control",
      "RANDDT": "2023-02-18",
      "LASTDOSEDT": "2023-09-23",
      "LASTFUDT": "2024-01-05",
      "TREATDUR_W": 31,
      "FU_POST_DOSE": 104,
      "FU_FROM_RAND": 321,
      "ADEQUATE_FU": 1,
      "STATUS": 2,
      "STATUS_LABEL": "COMPLETED"
    },
    {
      "USUBJID": "SUB0026",
      "TRT01A": "Experimental",
      "RANDDT": "2023-05-19",
      "LASTDOSEDT": "2024-01-12",
      "LASTFUDT": "2024-03-08",
      "TREATDUR_W": 34,
      "FU_POST_DOSE": 56,
      "FU_FROM_RAND": 294,
      "ADEQUATE_FU": 0,